<?xml version="1.0"?>
  <!DOCTYPE Report
[
<!ELEMENT Report (General ,(Doc|BPT)) >
<!ATTLIST Report ver CDATA #REQUIRED tmZone CDATA #REQUIRED>

<!ELEMENT General ( DocLocation ) >
<!ATTLIST General productName CDATA #REQUIRED productVer CDATA #REQUIRED os CDATA #REQUIRED host CDATA #REQUIRED>

<!ELEMENT BPT (DName,Res,DVer?,TSet?,TInst?,NodeArgs,Doc*) >
<!ATTLIST BPT rID ID #REQUIRED >

<!ELEMENT Doc (DName, Res, DVer?, TSet?, TInst?, RunType?, DT?, Step*, Action+, DIter*, Action*, Summary?, NodeArgs?)> 
<!ATTLIST Doc rID ID #REQUIRED type (Test|BC) "Test" productName CDATA #REQUIRED BCIter CDATA #IMPLIED >

<!ELEMENT RunType ( #PCDATA )>
<!ATTLIST RunType fmStep (False|True) "False" batch (False|True) "False" upDesc (False|True) "False" upChk (False|True) "False" upAS (False|True) "False">

<!ELEMENT DName ( #PCDATA ) >

<!ELEMENT Res ( #PCDATA ) >

<!ELEMENT DVer ( #PCDATA ) >

<!ELEMENT TSet ( #PCDATA ) >

<!ELEMENT TInst ( #PCDATA ) >

<!ELEMENT DIter (Step?,Action+,Summary?,NodeArgs)>
<!ATTLIST DIter rID ID #REQUIRED iterID CDATA #REQUIRED>

<!ELEMENT DocLocation ( #PCDATA )>

<!ELEMENT Action (AName,AIter*,(Step|HtmlStep|Action)*,Summary,NodeArgs) >
<!ATTLIST Action rID ID #REQUIRED>

<!ELEMENT AIter ((Step|HtmlStep|Action)*,Summary?,NodeArgs) >
<!ATTLIST AIter rID ID #REQUIRED iterID CDATA #REQUIRED>

<!ELEMENT AName ( #PCDATA ) >

<!ELEMENT Step (Obj,Details,Time,(Step|HtmlStep|Doc)*,NodeArgs) >
<!ATTLIST Step rID ID #REQUIRED retval CDATA #IMPLIED>

<!ELEMENT HtmlStep (HTML,(Step|HtmlStep|Doc)*,NodeArgs) >
<!ATTLIST HtmlStep rID ID #REQUIRED >

<!ELEMENT Obj ( #PCDATA ) >
<!ATTLIST Obj plainTxt (False|True) "True">

<!ELEMENT Details ( #PCDATA ) >
<!ATTLIST Details plainTxt (False|True) "True">

<!ELEMENT Time ( #PCDATA ) >

<!ELEMENT HTML ( #PCDATA ) >

<!ELEMENT Disp ( #PCDATA ) >

<!ELEMENT NodeArgs (Disp,TopPane?,BtmPane?)>
<!ATTLIST NodeArgs eType CDATA #REQUIRED icon CDATA #REQUIRED nRep CDATA #REQUIRED filter (False|True) "True">
<!ATTLIST NodeArgs status (Passed|Failed|Done|Warning|Information) "Done">
<!ATTLIST NodeArgs iconSel CDATA #IMPLIED nType CDATA #IMPLIED >

<!ELEMENT TopPane (Path)>

<!ELEMENT BtmPane ( (Path|WR)?,ASHilite?)>
<!ATTLIST BtmPane vType CDATA "HTML">

<!ELEMENT Path ( #PCDATA ) >

<!ELEMENT ASHilite ( #PCDATA ) >

<!ELEMENT WR ( #PCDATA ) >

<!ELEMENT DT (NodeArgs) >
<!ATTLIST DT rID ID #REQUIRED>

<!ELEMENT Summary (Param*)>
<!ATTLIST Summary sTime CDATA #IMPLIED eTime CDATA #IMPLIED passed CDATA #IMPLIED failed CDATA #IMPLIED warnings CDATA #IMPLIED retval CDATA #IMPLIED stopped (False|True) "False" >

<!ELEMENT Param (ParamName,ParamVal)+ >
<!ATTLIST Param paramInOut (In|Out) "In">

<!ELEMENT ParamName ( #PCDATA ) >

<!ELEMENT ParamVal ( #PCDATA ) >

]
> <Report ver="2.0" tmZone="中国标准时间">
<General productName="Vugen" productVer="11" os="" host="XIAN-FA07662"><DocLocation><![CDATA[D:\1. 项目\3.Cloud云项目\云性能\LR云性能脚本\AS]]></DocLocation></General>
<Doc rID="T1"   productName= "Vugen"  >
<DName><![CDATA[AS]]></DName>
<Res><![CDATA[result1]]></Res>
<Action rID="T2">
<AName><![CDATA[vuser_init]]></AName>
<Summary sTime="2016/10/17 - 11:36:12" eTime="2016/10/17 - 11:36:12" passed="0" failed="0" warnings="0" ></Summary>
<NodeArgs eType="StartAction" icon="2" nRep="5" >
<Disp><![CDATA[vuser_init Summary]]></Disp>
</NodeArgs>
</Action>
<DIter rID="T3" iterID="1" >
<Action rID="T4">
<AName><![CDATA[Action]]></AName>
<Step rID="T5">
<Obj plainTxt="False" ><![CDATA[Custom Request: AS]]></Obj>
<Details plainTxt="False" ><![CDATA[<CENTER><STRONG><FONT COLOR=#009A63>Step completed successfully</FONT></STRONG></CENTER>]]></Details>
<Time><![CDATA[2016/10/17 - 11:36:13]]></Time>
<NodeArgs eType="General" icon="4" nRep="9" status="Passed" >
<Disp><![CDATA[Custom Request: AS]]></Disp>
<BtmPane vType="HTMLSNSH">
<Path><![CDATA[\Iteration1\t1.inf]]></Path>
</BtmPane>
</NodeArgs>
</Step>
<Summary sTime="2016/10/17 - 11:36:12" eTime="2016/10/17 - 11:36:13" passed="1" failed="0" warnings="0" ></Summary>
<NodeArgs eType="StartAction" icon="2" nRep="8" status="Passed" >
<Disp><![CDATA[Action Summary]]></Disp>
</NodeArgs>
</Action>
<NodeArgs eType="StartIteration" icon="3" nRep="7" status="Passed" >
<Disp><![CDATA[AS Iteration 1 (Row 1)]]></Disp>
</NodeArgs>
</DIter>
<DIter rID="T6" iterID="2" >
<Action rID="T7">
<AName><![CDATA[Action]]></AName>
<Step rID="T8">
<Obj plainTxt="False" ><![CDATA[Custom Request: AS]]></Obj>
<Details plainTxt="False" ><![CDATA[<CENTER><STRONG><FONT COLOR=#009A63>Step completed successfully</FONT></STRONG></CENTER>]]></Details>
<Time><![CDATA[2016/10/17 - 11:36:13]]></Time>
<NodeArgs eType="General" icon="4" nRep="14" status="Passed" >
<Disp><![CDATA[Custom Request: AS]]></Disp>
<BtmPane vType="HTMLSNSH">
<Path><![CDATA[\Iteration2\t1.inf]]></Path>
</BtmPane>
</NodeArgs>
</Step>
<Summary sTime="2016/10/17 - 11:36:13" eTime="2016/10/17 - 11:36:13" passed="1" failed="0" warnings="0" ></Summary>
<NodeArgs eType="StartAction" icon="2" nRep="13" status="Passed" >
<Disp><![CDATA[Action Summary]]></Disp>
</NodeArgs>
</Action>
<NodeArgs eType="StartIteration" icon="3" nRep="12" status="Passed" >
<Disp><![CDATA[AS Iteration 2 (Row 2)]]></Disp>
</NodeArgs>
</DIter>
<DIter rID="T9" iterID="3" >
<Action rID="T10">
<AName><![CDATA[Action]]></AName>
<Step rID="T11">
<Obj plainTxt="False" ><![CDATA[Custom Request: AS]]></Obj>
<Details plainTxt="False" ><![CDATA[<CENTER><STRONG><FONT COLOR=#009A63>Step completed successfully</FONT></STRONG></CENTER>]]></Details>
<Time><![CDATA[2016/10/17 - 11:36:13]]></Time>
<NodeArgs eType="General" icon="4" nRep="19" status="Passed" >
<Disp><![CDATA[Custom Request: AS]]></Disp>
<BtmPane vType="HTMLSNSH">
<Path><![CDATA[\Iteration3\t1.inf]]></Path>
</BtmPane>
</NodeArgs>
</Step>
<Summary sTime="2016/10/17 - 11:36:13" eTime="2016/10/17 - 11:36:13" passed="1" failed="0" warnings="0" ></Summary>
<NodeArgs eType="StartAction" icon="2" nRep="18" status="Passed" >
<Disp><![CDATA[Action Summary]]></Disp>
</NodeArgs>
</Action>
<NodeArgs eType="StartIteration" icon="3" nRep="17" status="Passed" >
<Disp><![CDATA[AS Iteration 3 (Row 3)]]></Disp>
</NodeArgs>
</DIter>
<DIter rID="T12" iterID="4" >
<Action rID="T13">
<AName><![CDATA[Action]]></AName>
<Step rID="T14">
<Obj plainTxt="False" ><![CDATA[Custom Request: AS]]></Obj>
<Details plainTxt="False" ><![CDATA[<CENTER><STRONG><FONT COLOR=#009A63>Step completed successfully</FONT></STRONG></CENTER>]]></Details>
<Time><![CDATA[2016/10/17 - 11:36:13]]></Time>
<NodeArgs eType="General" icon="4" nRep="24" status="Passed" >
<Disp><![CDATA[Custom Request: AS]]></Disp>
<BtmPane vType="HTMLSNSH">
<Path><![CDATA[\Iteration4\t1.inf]]></Path>
</BtmPane>
</NodeArgs>
</Step>
<Summary sTime="2016/10/17 - 11:36:13" eTime="2016/10/17 - 11:36:13" passed="1" failed="0" warnings="0" ></Summary>
<NodeArgs eType="StartAction" icon="2" nRep="23" status="Passed" >
<Disp><![CDATA[Action Summary]]></Disp>
</NodeArgs>
</Action>
<NodeArgs eType="StartIteration" icon="3" nRep="22" status="Passed" >
<Disp><![CDATA[AS Iteration 4 (Row 4)]]></Disp>
</NodeArgs>
</DIter>
<DIter rID="T15" iterID="5" >
<Action rID="T16">
<AName><![CDATA[Action]]></AName>
<Step rID="T17">
<Obj plainTxt="False" ><![CDATA[Custom Request: AS]]></Obj>
<Details plainTxt="False" ><![CDATA[<CENTER><STRONG><FONT COLOR=#009A63>Step completed successfully</FONT></STRONG></CENTER>]]></Details>
<Time><![CDATA[2016/10/17 - 11:36:14]]></Time>
<NodeArgs eType="General" icon="4" nRep="29" status="Passed" >
<Disp><![CDATA[Custom Request: AS]]></Disp>
<BtmPane vType="HTMLSNSH">
<Path><![CDATA[\Iteration5\t1.inf]]></Path>
</BtmPane>
</NodeArgs>
</Step>
<Summary sTime="2016/10/17 - 11:36:13" eTime="2016/10/17 - 11:36:14" passed="1" failed="0" warnings="0" ></Summary>
<NodeArgs eType="StartAction" icon="2" nRep="28" status="Passed" >
<Disp><![CDATA[Action Summary]]></Disp>
</NodeArgs>
</Action>
<NodeArgs eType="StartIteration" icon="3" nRep="27" status="Passed" >
<Disp><![CDATA[AS Iteration 5 (Row 5)]]></Disp>
</NodeArgs>
</DIter>
<DIter rID="T18" iterID="6" >
<Action rID="T19">
<AName><![CDATA[Action]]></AName>
<Step rID="T20">
<Obj plainTxt="False" ><![CDATA[Custom Request: AS]]></Obj>
<Details plainTxt="False" ><![CDATA[<CENTER><STRONG><FONT COLOR=#009A63>Step completed successfully</FONT></STRONG></CENTER>]]></Details>
<Time><![CDATA[2016/10/17 - 11:36:14]]></Time>
<NodeArgs eType="General" icon="4" nRep="34" status="Passed" >
<Disp><![CDATA[Custom Request: AS]]></Disp>
<BtmPane vType="HTMLSNSH">
<Path><![CDATA[\Iteration6\t1.inf]]></Path>
</BtmPane>
</NodeArgs>
</Step>
<Summary sTime="2016/10/17 - 11:36:14" eTime="2016/10/17 - 11:36:14" passed="1" failed="0" warnings="0" ></Summary>
<NodeArgs eType="StartAction" icon="2" nRep="33" status="Passed" >
<Disp><![CDATA[Action Summary]]></Disp>
</NodeArgs>
</Action>
<NodeArgs eType="StartIteration" icon="3" nRep="32" status="Passed" >
<Disp><![CDATA[AS Iteration 6 (Row 6)]]></Disp>
</NodeArgs>
</DIter>
<DIter rID="T21" iterID="7" >
<Action rID="T22">
<AName><![CDATA[Action]]></AName>
<Step rID="T23">
<Obj plainTxt="False" ><![CDATA[Custom Request: AS]]></Obj>
<Details plainTxt="False" ><![CDATA[<CENTER><STRONG><FONT COLOR=#009A63>Step completed successfully</FONT></STRONG></CENTER>]]></Details>
<Time><![CDATA[2016/10/17 - 11:36:14]]></Time>
<NodeArgs eType="General" icon="4" nRep="39" status="Passed" >
<Disp><![CDATA[Custom Request: AS]]></Disp>
<BtmPane vType="HTMLSNSH">
<Path><![CDATA[\Iteration7\t1.inf]]></Path>
</BtmPane>
</NodeArgs>
</Step>
<Summary sTime="2016/10/17 - 11:36:14" eTime="2016/10/17 - 11:36:14" passed="1" failed="0" warnings="0" ></Summary>
<NodeArgs eType="StartAction" icon="2" nRep="38" status="Passed" >
<Disp><![CDATA[Action Summary]]></Disp>
</NodeArgs>
</Action>
<NodeArgs eType="StartIteration" icon="3" nRep="37" status="Passed" >
<Disp><![CDATA[AS Iteration 7 (Row 7)]]></Disp>
</NodeArgs>
</DIter>
<DIter rID="T24" iterID="8" >
<Action rID="T25">
<AName><![CDATA[Action]]></AName>
<Step rID="T26">
<Obj plainTxt="False" ><![CDATA[Custom Request: AS]]></Obj>
<Details plainTxt="False" ><![CDATA[<CENTER><STRONG><FONT COLOR=#009A63>Step completed successfully</FONT></STRONG></CENTER>]]></Details>
<Time><![CDATA[2016/10/17 - 11:36:14]]></Time>
<NodeArgs eType="General" icon="4" nRep="44" status="Passed" >
<Disp><![CDATA[Custom Request: AS]]></Disp>
<BtmPane vType="HTMLSNSH">
<Path><![CDATA[\Iteration8\t1.inf]]></Path>
</BtmPane>
</NodeArgs>
</Step>
<Summary sTime="2016/10/17 - 11:36:14" eTime="2016/10/17 - 11:36:15" passed="1" failed="0" warnings="0" ></Summary>
<NodeArgs eType="StartAction" icon="2" nRep="43" status="Passed" >
<Disp><![CDATA[Action Summary]]></Disp>
</NodeArgs>
</Action>
<NodeArgs eType="StartIteration" icon="3" nRep="42" status="Passed" >
<Disp><![CDATA[AS Iteration 8 (Row 8)]]></Disp>
</NodeArgs>
</DIter>
<DIter rID="T27" iterID="9" >
<Action rID="T28">
<AName><![CDATA[Action]]></AName>
<Step rID="T29">
<Obj plainTxt="False" ><![CDATA[Custom Request: AS]]></Obj>
<Details plainTxt="False" ><![CDATA[<CENTER><STRONG><FONT COLOR=#009A63>Step completed successfully</FONT></STRONG></CENTER>]]></Details>
<Time><![CDATA[2016/10/17 - 11:36:15]]></Time>
<NodeArgs eType="General" icon="4" nRep="49" status="Passed" >
<Disp><![CDATA[Custom Request: AS]]></Disp>
<BtmPane vType="HTMLSNSH">
<Path><![CDATA[\Iteration9\t1.inf]]></Path>
</BtmPane>
</NodeArgs>
</Step>
<Summary sTime="2016/10/17 - 11:36:15" eTime="2016/10/17 - 11:36:15" passed="1" failed="0" warnings="0" ></Summary>
<NodeArgs eType="StartAction" icon="2" nRep="48" status="Passed" >
<Disp><![CDATA[Action Summary]]></Disp>
</NodeArgs>
</Action>
<NodeArgs eType="StartIteration" icon="3" nRep="47" status="Passed" >
<Disp><![CDATA[AS Iteration 9 (Row 9)]]></Disp>
</NodeArgs>
</DIter>
<DIter rID="T30" iterID="10" >
<Action rID="T31">
<AName><![CDATA[Action]]></AName>
<Step rID="T32">
<Obj plainTxt="False" ><![CDATA[Custom Request: AS]]></Obj>
<Details plainTxt="False" ><![CDATA[<CENTER><STRONG><FONT COLOR=#009A63>Step completed successfully</FONT></STRONG></CENTER>]]></Details>
<Time><![CDATA[2016/10/17 - 11:36:15]]></Time>
<NodeArgs eType="General" icon="4" nRep="54" status="Passed" >
<Disp><![CDATA[Custom Request: AS]]></Disp>
<BtmPane vType="HTMLSNSH">
<Path><![CDATA[\Iteration10\t1.inf]]></Path>
</BtmPane>
</NodeArgs>
</Step>
<Summary sTime="2016/10/17 - 11:36:15" eTime="2016/10/17 - 11:36:15" passed="1" failed="0" warnings="0" ></Summary>
<NodeArgs eType="StartAction" icon="2" nRep="53" status="Passed" >
<Disp><![CDATA[Action Summary]]></Disp>
</NodeArgs>
</Action>
<NodeArgs eType="StartIteration" icon="3" nRep="52" status="Passed" >
<Disp><![CDATA[AS Iteration 10 (Row 10)]]></Disp>
</NodeArgs>
</DIter>
<DIter rID="T33" iterID="11" >
<Action rID="T34">
<AName><![CDATA[Action]]></AName>
<Step rID="T35">
<Obj plainTxt="False" ><![CDATA[Custom Request: AS]]></Obj>
<Details plainTxt="False" ><![CDATA[<CENTER><STRONG><FONT COLOR=#009A63>Step completed successfully</FONT></STRONG></CENTER>]]></Details>
<Time><![CDATA[2016/10/17 - 11:36:15]]></Time>
<NodeArgs eType="General" icon="4" nRep="59" status="Passed" >
<Disp><![CDATA[Custom Request: AS]]></Disp>
<BtmPane vType="HTMLSNSH">
<Path><![CDATA[\Iteration11\t1.inf]]></Path>
</BtmPane>
</NodeArgs>
</Step>
<Summary sTime="2016/10/17 - 11:36:15" eTime="2016/10/17 - 11:36:15" passed="1" failed="0" warnings="0" ></Summary>
<NodeArgs eType="StartAction" icon="2" nRep="58" status="Passed" >
<Disp><![CDATA[Action Summary]]></Disp>
</NodeArgs>
</Action>
<NodeArgs eType="StartIteration" icon="3" nRep="57" status="Passed" >
<Disp><![CDATA[AS Iteration 11 (Row 11)]]></Disp>
</NodeArgs>
</DIter>
<DIter rID="T36" iterID="12" >
<Action rID="T37">
<AName><![CDATA[Action]]></AName>
<Step rID="T38">
<Obj plainTxt="False" ><![CDATA[Custom Request: AS]]></Obj>
<Details plainTxt="False" ><![CDATA[<CENTER><STRONG><FONT COLOR=#009A63>Step completed successfully</FONT></STRONG></CENTER>]]></Details>
<Time><![CDATA[2016/10/17 - 11:36:15]]></Time>
<NodeArgs eType="General" icon="4" nRep="64" status="Passed" >
<Disp><![CDATA[Custom Request: AS]]></Disp>
<BtmPane vType="HTMLSNSH">
<Path><![CDATA[\Iteration12\t1.inf]]></Path>
</BtmPane>
</NodeArgs>
</Step>
<Summary sTime="2016/10/17 - 11:36:15" eTime="2016/10/17 - 11:36:15" passed="1" failed="0" warnings="0" ></Summary>
<NodeArgs eType="StartAction" icon="2" nRep="63" status="Passed" >
<Disp><![CDATA[Action Summary]]></Disp>
</NodeArgs>
</Action>
<NodeArgs eType="StartIteration" icon="3" nRep="62" status="Passed" >
<Disp><![CDATA[AS Iteration 12 (Row 12)]]></Disp>
</NodeArgs>
</DIter>
<DIter rID="T39" iterID="13" >
<Action rID="T40">
<AName><![CDATA[Action]]></AName>
<Step rID="T41">
<Obj plainTxt="False" ><![CDATA[Custom Request: AS]]></Obj>
<Details plainTxt="False" ><![CDATA[<CENTER><STRONG><FONT COLOR=#009A63>Step completed successfully</FONT></STRONG></CENTER>]]></Details>
<Time><![CDATA[2016/10/17 - 11:36:15]]></Time>
<NodeArgs eType="General" icon="4" nRep="69" status="Passed" >
<Disp><![CDATA[Custom Request: AS]]></Disp>
<BtmPane vType="HTMLSNSH">
<Path><![CDATA[\Iteration13\t1.inf]]></Path>
</BtmPane>
</NodeArgs>
</Step>
<Summary sTime="2016/10/17 - 11:36:15" eTime="2016/10/17 - 11:36:15" passed="1" failed="0" warnings="0" ></Summary>
<NodeArgs eType="StartAction" icon="2" nRep="68" status="Passed" >
<Disp><![CDATA[Action Summary]]></Disp>
</NodeArgs>
</Action>
<NodeArgs eType="StartIteration" icon="3" nRep="67" status="Passed" >
<Disp><![CDATA[AS Iteration 13 (Row 13)]]></Disp>
</NodeArgs>
</DIter>
<DIter rID="T42" iterID="14" >
<Action rID="T43">
<AName><![CDATA[Action]]></AName>
<Step rID="T44">
<Obj plainTxt="False" ><![CDATA[Custom Request: AS]]></Obj>
<Details plainTxt="False" ><![CDATA[<CENTER><STRONG><FONT COLOR=#009A63>Step completed successfully</FONT></STRONG></CENTER>]]></Details>
<Time><![CDATA[2016/10/17 - 11:36:16]]></Time>
<NodeArgs eType="General" icon="4" nRep="74" status="Passed" >
<Disp><![CDATA[Custom Request: AS]]></Disp>
<BtmPane vType="HTMLSNSH">
<Path><![CDATA[\Iteration14\t1.inf]]></Path>
</BtmPane>
</NodeArgs>
</Step>
<Summary sTime="2016/10/17 - 11:36:15" eTime="2016/10/17 - 11:36:16" passed="1" failed="0" warnings="0" ></Summary>
<NodeArgs eType="StartAction" icon="2" nRep="73" status="Passed" >
<Disp><![CDATA[Action Summary]]></Disp>
</NodeArgs>
</Action>
<NodeArgs eType="StartIteration" icon="3" nRep="72" status="Passed" >
<Disp><![CDATA[AS Iteration 14 (Row 14)]]></Disp>
</NodeArgs>
</DIter>
<DIter rID="T45" iterID="15" >
<Action rID="T46">
<AName><![CDATA[Action]]></AName>
<Step rID="T47">
<Obj plainTxt="False" ><![CDATA[Custom Request: AS]]></Obj>
<Details plainTxt="False" ><![CDATA[<CENTER><STRONG><FONT COLOR=#009A63>Step completed successfully</FONT></STRONG></CENTER>]]></Details>
<Time><![CDATA[2016/10/17 - 11:36:16]]></Time>
<NodeArgs eType="General" icon="4" nRep="79" status="Passed" >
<Disp><![CDATA[Custom Request: AS]]></Disp>
<BtmPane vType="HTMLSNSH">
<Path><![CDATA[\Iteration15\t1.inf]]></Path>
</BtmPane>
</NodeArgs>
</Step>
<Summary sTime="2016/10/17 - 11:36:16" eTime="2016/10/17 - 11:36:16" passed="1" failed="0" warnings="0" ></Summary>
<NodeArgs eType="StartAction" icon="2" nRep="78" status="Passed" >
<Disp><![CDATA[Action Summary]]></Disp>
</NodeArgs>
</Action>
<NodeArgs eType="StartIteration" icon="3" nRep="77" status="Passed" >
<Disp><![CDATA[AS Iteration 15 (Row 15)]]></Disp>
</NodeArgs>
</DIter>
<DIter rID="T48" iterID="16" >
<Action rID="T49">
<AName><![CDATA[Action]]></AName>
<Step rID="T50">
<Obj plainTxt="False" ><![CDATA[Custom Request: AS]]></Obj>
<Details plainTxt="False" ><![CDATA[<CENTER><STRONG><FONT COLOR=#009A63>Step completed successfully</FONT></STRONG></CENTER>]]></Details>
<Time><![CDATA[2016/10/17 - 11:36:16]]></Time>
<NodeArgs eType="General" icon="4" nRep="84" status="Passed" >
<Disp><![CDATA[Custom Request: AS]]></Disp>
<BtmPane vType="HTMLSNSH">
<Path><![CDATA[\Iteration16\t1.inf]]></Path>
</BtmPane>
</NodeArgs>
</Step>
<Summary sTime="2016/10/17 - 11:36:16" eTime="2016/10/17 - 11:36:16" passed="1" failed="0" warnings="0" ></Summary>
<NodeArgs eType="StartAction" icon="2" nRep="83" status="Passed" >
<Disp><![CDATA[Action Summary]]></Disp>
</NodeArgs>
</Action>
<NodeArgs eType="StartIteration" icon="3" nRep="82" status="Passed" >
<Disp><![CDATA[AS Iteration 16 (Row 16)]]></Disp>
</NodeArgs>
</DIter>
<DIter rID="T51" iterID="17" >
<Action rID="T52">
<AName><![CDATA[Action]]></AName>
<Step rID="T53">
<Obj plainTxt="False" ><![CDATA[Custom Request: AS]]></Obj>
<Details plainTxt="False" ><![CDATA[<CENTER><STRONG><FONT COLOR=#009A63>Step completed successfully</FONT></STRONG></CENTER>]]></Details>
<Time><![CDATA[2016/10/17 - 11:36:16]]></Time>
<NodeArgs eType="General" icon="4" nRep="89" status="Passed" >
<Disp><![CDATA[Custom Request: AS]]></Disp>
<BtmPane vType="HTMLSNSH">
<Path><![CDATA[\Iteration17\t1.inf]]></Path>
</BtmPane>
</NodeArgs>
</Step>
<Summary sTime="2016/10/17 - 11:36:16" eTime="2016/10/17 - 11:36:16" passed="1" failed="0" warnings="0" ></Summary>
<NodeArgs eType="StartAction" icon="2" nRep="88" status="Passed" >
<Disp><![CDATA[Action Summary]]></Disp>
</NodeArgs>
</Action>
<NodeArgs eType="StartIteration" icon="3" nRep="87" status="Passed" >
<Disp><![CDATA[AS Iteration 17 (Row 17)]]></Disp>
</NodeArgs>
</DIter>
<DIter rID="T54" iterID="18" >
<Action rID="T55">
<AName><![CDATA[Action]]></AName>
<Step rID="T56">
<Obj plainTxt="False" ><![CDATA[Custom Request: AS]]></Obj>
<Details plainTxt="False" ><![CDATA[<CENTER><STRONG><FONT COLOR=#009A63>Step completed successfully</FONT></STRONG></CENTER>]]></Details>
<Time><![CDATA[2016/10/17 - 11:36:16]]></Time>
<NodeArgs eType="General" icon="4" nRep="94" status="Passed" >
<Disp><![CDATA[Custom Request: AS]]></Disp>
<BtmPane vType="HTMLSNSH">
<Path><![CDATA[\Iteration18\t1.inf]]></Path>
</BtmPane>
</NodeArgs>
</Step>
<Summary sTime="2016/10/17 - 11:36:16" eTime="2016/10/17 - 11:36:16" passed="1" failed="0" warnings="0" ></Summary>
<NodeArgs eType="StartAction" icon="2" nRep="93" status="Passed" >
<Disp><![CDATA[Action Summary]]></Disp>
</NodeArgs>
</Action>
<NodeArgs eType="StartIteration" icon="3" nRep="92" status="Passed" >
<Disp><![CDATA[AS Iteration 18 (Row 18)]]></Disp>
</NodeArgs>
</DIter>
<DIter rID="T57" iterID="19" >
<Action rID="T58">
<AName><![CDATA[Action]]></AName>
<Step rID="T59">
<Obj plainTxt="False" ><![CDATA[Custom Request: AS]]></Obj>
<Details plainTxt="False" ><![CDATA[<CENTER><STRONG><FONT COLOR=#009A63>Step completed successfully</FONT></STRONG></CENTER>]]></Details>
<Time><![CDATA[2016/10/17 - 11:36:16]]></Time>
<NodeArgs eType="General" icon="4" nRep="99" status="Passed" >
<Disp><![CDATA[Custom Request: AS]]></Disp>
<BtmPane vType="HTMLSNSH">
<Path><![CDATA[\Iteration19\t1.inf]]></Path>
</BtmPane>
</NodeArgs>
</Step>
<Summary sTime="2016/10/17 - 11:36:16" eTime="2016/10/17 - 11:36:16" passed="1" failed="0" warnings="0" ></Summary>
<NodeArgs eType="StartAction" icon="2" nRep="98" status="Passed" >
<Disp><![CDATA[Action Summary]]></Disp>
</NodeArgs>
</Action>
<NodeArgs eType="StartIteration" icon="3" nRep="97" status="Passed" >
<Disp><![CDATA[AS Iteration 19 (Row 19)]]></Disp>
</NodeArgs>
</DIter>
<DIter rID="T60" iterID="20" >
<Action rID="T61">
<AName><![CDATA[Action]]></AName>
<Step rID="T62">
<Obj plainTxt="False" ><![CDATA[Custom Request: AS]]></Obj>
<Details plainTxt="False" ><![CDATA[<CENTER><STRONG><FONT COLOR=#009A63>Step completed successfully</FONT></STRONG></CENTER>]]></Details>
<Time><![CDATA[2016/10/17 - 11:36:17]]></Time>
<NodeArgs eType="General" icon="4" nRep="104" status="Passed" >
<Disp><![CDATA[Custom Request: AS]]></Disp>
<BtmPane vType="HTMLSNSH">
<Path><![CDATA[\Iteration20\t1.inf]]></Path>
</BtmPane>
</NodeArgs>
</Step>
<Summary sTime="2016/10/17 - 11:36:16" eTime="2016/10/17 - 11:36:17" passed="1" failed="0" warnings="0" ></Summary>
<NodeArgs eType="StartAction" icon="2" nRep="103" status="Passed" >
<Disp><![CDATA[Action Summary]]></Disp>
</NodeArgs>
</Action>
<NodeArgs eType="StartIteration" icon="3" nRep="102" status="Passed" >
<Disp><![CDATA[AS Iteration 20 (Row 20)]]></Disp>
</NodeArgs>
</DIter>
<DIter rID="T63" iterID="21" >
<Action rID="T64">
<AName><![CDATA[Action]]></AName>
<Step rID="T65">
<Obj plainTxt="False" ><![CDATA[Custom Request: AS]]></Obj>
<Details plainTxt="False" ><![CDATA[<CENTER><STRONG><FONT COLOR=#009A63>Step completed successfully</FONT></STRONG></CENTER>]]></Details>
<Time><![CDATA[2016/10/17 - 11:36:17]]></Time>
<NodeArgs eType="General" icon="4" nRep="109" status="Passed" >
<Disp><![CDATA[Custom Request: AS]]></Disp>
<BtmPane vType="HTMLSNSH">
<Path><![CDATA[\Iteration21\t1.inf]]></Path>
</BtmPane>
</NodeArgs>
</Step>
<Summary sTime="2016/10/17 - 11:36:17" eTime="2016/10/17 - 11:36:17" passed="1" failed="0" warnings="0" ></Summary>
<NodeArgs eType="StartAction" icon="2" nRep="108" status="Passed" >
<Disp><![CDATA[Action Summary]]></Disp>
</NodeArgs>
</Action>
<NodeArgs eType="StartIteration" icon="3" nRep="107" status="Passed" >
<Disp><![CDATA[AS Iteration 21 (Row 21)]]></Disp>
</NodeArgs>
</DIter>
<DIter rID="T66" iterID="22" >
<Action rID="T67">
<AName><![CDATA[Action]]></AName>
<Step rID="T68">
<Obj plainTxt="False" ><![CDATA[Custom Request: AS]]></Obj>
<Details plainTxt="False" ><![CDATA[<CENTER><STRONG><FONT COLOR=#009A63>Step completed successfully</FONT></STRONG></CENTER>]]></Details>
<Time><![CDATA[2016/10/17 - 11:36:17]]></Time>
<NodeArgs eType="General" icon="4" nRep="114" status="Passed" >
<Disp><![CDATA[Custom Request: AS]]></Disp>
<BtmPane vType="HTMLSNSH">
<Path><![CDATA[\Iteration22\t1.inf]]></Path>
</BtmPane>
</NodeArgs>
</Step>
<Summary sTime="2016/10/17 - 11:36:17" eTime="2016/10/17 - 11:36:17" passed="1" failed="0" warnings="0" ></Summary>
<NodeArgs eType="StartAction" icon="2" nRep="113" status="Passed" >
<Disp><![CDATA[Action Summary]]></Disp>
</NodeArgs>
</Action>
<NodeArgs eType="StartIteration" icon="3" nRep="112" status="Passed" >
<Disp><![CDATA[AS Iteration 22 (Row 22)]]></Disp>
</NodeArgs>
</DIter>
<DIter rID="T69" iterID="23" >
<Action rID="T70">
<AName><![CDATA[Action]]></AName>
<Step rID="T71">
<Obj plainTxt="False" ><![CDATA[Custom Request: AS]]></Obj>
<Details plainTxt="False" ><![CDATA[<CENTER><STRONG><FONT COLOR=#009A63>Step completed successfully</FONT></STRONG></CENTER>]]></Details>
<Time><![CDATA[2016/10/17 - 11:36:17]]></Time>
<NodeArgs eType="General" icon="4" nRep="119" status="Passed" >
<Disp><![CDATA[Custom Request: AS]]></Disp>
<BtmPane vType="HTMLSNSH">
<Path><![CDATA[\Iteration23\t1.inf]]></Path>
</BtmPane>
</NodeArgs>
</Step>
<Summary sTime="2016/10/17 - 11:36:17" eTime="2016/10/17 - 11:36:17" passed="1" failed="0" warnings="0" ></Summary>
<NodeArgs eType="StartAction" icon="2" nRep="118" status="Passed" >
<Disp><![CDATA[Action Summary]]></Disp>
</NodeArgs>
</Action>
<NodeArgs eType="StartIteration" icon="3" nRep="117" status="Passed" >
<Disp><![CDATA[AS Iteration 23 (Row 23)]]></Disp>
</NodeArgs>
</DIter>
<DIter rID="T72" iterID="24" >
<Action rID="T73">
<AName><![CDATA[Action]]></AName>
<Step rID="T74">
<Obj plainTxt="False" ><![CDATA[Custom Request: AS]]></Obj>
<Details plainTxt="False" ><![CDATA[<CENTER><STRONG><FONT COLOR=#009A63>Step completed successfully</FONT></STRONG></CENTER>]]></Details>
<Time><![CDATA[2016/10/17 - 11:36:17]]></Time>
<NodeArgs eType="General" icon="4" nRep="124" status="Passed" >
<Disp><![CDATA[Custom Request: AS]]></Disp>
<BtmPane vType="HTMLSNSH">
<Path><![CDATA[\Iteration24\t1.inf]]></Path>
</BtmPane>
</NodeArgs>
</Step>
<Summary sTime="2016/10/17 - 11:36:17" eTime="2016/10/17 - 11:36:17" passed="1" failed="0" warnings="0" ></Summary>
<NodeArgs eType="StartAction" icon="2" nRep="123" status="Passed" >
<Disp><![CDATA[Action Summary]]></Disp>
</NodeArgs>
</Action>
<NodeArgs eType="StartIteration" icon="3" nRep="122" status="Passed" >
<Disp><![CDATA[AS Iteration 24 (Row 24)]]></Disp>
</NodeArgs>
</DIter>
<DIter rID="T75" iterID="25" >
<Action rID="T76">
<AName><![CDATA[Action]]></AName>
<Step rID="T77">
<Obj plainTxt="False" ><![CDATA[Custom Request: AS]]></Obj>
<Details plainTxt="False" ><![CDATA[<CENTER><STRONG><FONT COLOR=#009A63>Step completed successfully</FONT></STRONG></CENTER>]]></Details>
<Time><![CDATA[2016/10/17 - 11:36:18]]></Time>
<NodeArgs eType="General" icon="4" nRep="129" status="Passed" >
<Disp><![CDATA[Custom Request: AS]]></Disp>
<BtmPane vType="HTMLSNSH">
<Path><![CDATA[\Iteration25\t1.inf]]></Path>
</BtmPane>
</NodeArgs>
</Step>
<Summary sTime="2016/10/17 - 11:36:18" eTime="2016/10/17 - 11:36:18" passed="1" failed="0" warnings="0" ></Summary>
<NodeArgs eType="StartAction" icon="2" nRep="128" status="Passed" >
<Disp><![CDATA[Action Summary]]></Disp>
</NodeArgs>
</Action>
<NodeArgs eType="StartIteration" icon="3" nRep="127" status="Passed" >
<Disp><![CDATA[AS Iteration 25 (Row 25)]]></Disp>
</NodeArgs>
</DIter>
<DIter rID="T78" iterID="26" >
<Action rID="T79">
<AName><![CDATA[Action]]></AName>
<Step rID="T80">
<Obj plainTxt="False" ><![CDATA[Custom Request: AS]]></Obj>
<Details plainTxt="False" ><![CDATA[<CENTER><STRONG><FONT COLOR=#009A63>Step completed successfully</FONT></STRONG></CENTER>]]></Details>
<Time><![CDATA[2016/10/17 - 11:36:18]]></Time>
<NodeArgs eType="General" icon="4" nRep="134" status="Passed" >
<Disp><![CDATA[Custom Request: AS]]></Disp>
<BtmPane vType="HTMLSNSH">
<Path><![CDATA[\Iteration26\t1.inf]]></Path>
</BtmPane>
</NodeArgs>
</Step>
<Summary sTime="2016/10/17 - 11:36:18" eTime="2016/10/17 - 11:36:18" passed="1" failed="0" warnings="0" ></Summary>
<NodeArgs eType="StartAction" icon="2" nRep="133" status="Passed" >
<Disp><![CDATA[Action Summary]]></Disp>
</NodeArgs>
</Action>
<NodeArgs eType="StartIteration" icon="3" nRep="132" status="Passed" >
<Disp><![CDATA[AS Iteration 26 (Row 26)]]></Disp>
</NodeArgs>
</DIter>
<DIter rID="T81" iterID="27" >
<Action rID="T82">
<AName><![CDATA[Action]]></AName>
<Step rID="T83">
<Obj plainTxt="False" ><![CDATA[Custom Request: AS]]></Obj>
<Details plainTxt="False" ><![CDATA[<CENTER><STRONG><FONT COLOR=#009A63>Step completed successfully</FONT></STRONG></CENTER>]]></Details>
<Time><![CDATA[2016/10/17 - 11:36:18]]></Time>
<NodeArgs eType="General" icon="4" nRep="139" status="Passed" >
<Disp><![CDATA[Custom Request: AS]]></Disp>
<BtmPane vType="HTMLSNSH">
<Path><![CDATA[\Iteration27\t1.inf]]></Path>
</BtmPane>
</NodeArgs>
</Step>
<Summary sTime="2016/10/17 - 11:36:18" eTime="2016/10/17 - 11:36:18" passed="1" failed="0" warnings="0" ></Summary>
<NodeArgs eType="StartAction" icon="2" nRep="138" status="Passed" >
<Disp><![CDATA[Action Summary]]></Disp>
</NodeArgs>
</Action>
<NodeArgs eType="StartIteration" icon="3" nRep="137" status="Passed" >
<Disp><![CDATA[AS Iteration 27 (Row 27)]]></Disp>
</NodeArgs>
</DIter>
<DIter rID="T84" iterID="28" >
<Action rID="T85">
<AName><![CDATA[Action]]></AName>
<Step rID="T86">
<Obj plainTxt="False" ><![CDATA[Custom Request: AS]]></Obj>
<Details plainTxt="False" ><![CDATA[<CENTER><STRONG><FONT COLOR=#009A63>Step completed successfully</FONT></STRONG></CENTER>]]></Details>
<Time><![CDATA[2016/10/17 - 11:36:18]]></Time>
<NodeArgs eType="General" icon="4" nRep="144" status="Passed" >
<Disp><![CDATA[Custom Request: AS]]></Disp>
<BtmPane vType="HTMLSNSH">
<Path><![CDATA[\Iteration28\t1.inf]]></Path>
</BtmPane>
</NodeArgs>
</Step>
<Summary sTime="2016/10/17 - 11:36:18" eTime="2016/10/17 - 11:36:18" passed="1" failed="0" warnings="0" ></Summary>
<NodeArgs eType="StartAction" icon="2" nRep="143" status="Passed" >
<Disp><![CDATA[Action Summary]]></Disp>
</NodeArgs>
</Action>
<NodeArgs eType="StartIteration" icon="3" nRep="142" status="Passed" >
<Disp><![CDATA[AS Iteration 28 (Row 28)]]></Disp>
</NodeArgs>
</DIter>
<DIter rID="T87" iterID="29" >
<Action rID="T88">
<AName><![CDATA[Action]]></AName>
<Step rID="T89">
<Obj plainTxt="False" ><![CDATA[Custom Request: AS]]></Obj>
<Details plainTxt="False" ><![CDATA[<CENTER><STRONG><FONT COLOR=#009A63>Step completed successfully</FONT></STRONG></CENTER>]]></Details>